categories,subcategories,items,description,notes
0,0A,0A001,"""Nuclear reactors"" and specially designed or prepared equipment and components therefor, as follows:",
0,0A,0A001.a.,"""Nuclear reactors"";",
0,0A,0A001.b.,"Metal vessels, or major shop-fabricated parts therefor, including the reactor vessel head for a reactor pressure vessel, specially designed or prepared to contain the core of a ""nuclear reactor"";",
0,0A,0A001.c.,"Manipulative equipment specially designed or prepared for inserting or removing fuel in a ""nuclear reactor"";",
0,0A,0A001.d.,"Control rods specially designed or prepared for the control of the fission process in a ""nuclear reactor"", support or suspension structures therefor, rod drive mechanisms and rod guide tubes;",
0,0A,0A001.e.,"Pressure tubes specially designed or prepared to contain both fuel elements and the primary coolant in a ""nuclear reactor"";",
0,0A,0A001.f.,"Zirconium metal tubes or zirconium alloy tubes (or assembles of tubes) specially designed or prepared for use as fuel cladding in a ""nuclear reactor"", and in quantities exceeding 10 kg;",
0,0A,0A001.f.,,For zirconium pressure tubes see 0A001.e. and for calandria tubes see 0A001.h.
0,0A,0A001.g.,"Coolant pumps or circulators specially designed or prepared for circulating the primary coolant of ""nuclear reactors"";",
0,0A,0A001.g.,,"'In 0A001.h. nuclear reactor internals means any major structure within a reactor vessel which has one or more functions such as supporting the core, maintaining fuel alignment, directing primary coolant flow, providing radiation shields for the reactor vessel, and guiding in-core instrumentation.'"
0,0A,0A001.i.,Heat exchangers as follows:,
0,0A,0A001.i.1.,"Steam generators specially designed or prepared for the primary, or intermediate, coolant circuit of a ""nuclear reactor"";",
0,0A,0A001.i.2.,"Other heat exchangers specially designed or prepared for use in the primary coolant circuit of a ""nuclear reactor"";",
0,0A,0A001.i.2.,,"0A001.i. does not control heat exchangers for the supporting systems of the reactor, e.g., the emergency cooling system or the decay heat cooling system."
0,0A,0A001.j.,"Neutron detectors specially designed or prepared for determining neutron flux levels within the core of a ""nuclear reactor"";",
0,0A,0A001.j.,,'In 0A001.k. external thermal shields means major structures placed over the reactor vessel which reduce heat loss from the reactor and reduce temperature within the containment vessel.'
0,0B,0B001,"Plant for the separation of isotopes of ""natural uranium"", ""depleted uranium"" or ""special fissile materials"", and specially designed or prepared equipment and components therefor, as follows:",
0,0B,0B001.a.,"Plant specially designed for separating isotopes of ""natural uranium"", ""depleted uranium"", or ""special fissile materials"", as follows:",
0,0B,0B001.a.1.,Gas centrifuge separation plant;,
0,0B,0B001.a.2.,Gaseous diffusion separation plant;,
0,0B,0B001.a.3.,Aerodynamic separation plant;,
0,0B,0B001.a.4.,Chemical exchange separation plant;,
0,0B,0B001.a.5.,Ion-exchange separation plant;,
0,0B,0B001.a.6.,"Atomic vapour ""laser"" isotope separation plant;",
0,0B,0B001.a.7.,"Molecular ""laser"" isotope separation plant;",
0,0B,0B001.a.8.,Plasma separation plant;,
0,0B,0B001.a.9.,Electro magnetic separation plant;,
0,0B,0B001.a.9.,,"'In 0B001.b. high strength-to-density ratio material means any of the following:', '1.Maraging steel capable of an ultimate tensile strength of 1,95 GPa or more;', '2.Aluminium alloys capable of an ultimate tensile strength of 0,46 GPa or more;or', '3.Fibrous or filamentary materials with a specific modulus of more than 3,18x106m and a specific tensile strength greater than 7,62x 104 m;', '1.Gas centrifuges;', '2.Complete rotor assemblies;', '3.Rotor tube cylinders with a wall thickness of 12 mm or less, a diameter of between 75mm and650 mm, made from high strength-to-density ratio materials;', '4.Rings or bellows with a wall thickness of 3 mm or less and a diameter of between 75mm and650 mm and designed to give local support to a rotor tube or to join a number together, made from high strength-to-density ratio materials;', '5.Baffles of between 75 mm and650 mm diameter for mounting inside a rotor tube, made from high strength-to-density ratio materials;', '6.Top or bottom caps of between 75 mm and650 mm diameter to fit the ends of a rotor tube, made from high strength-to-density ratio materials;', '7.Magnetic suspension bearings as follows:a.Bearing assemblies consisting of an annular magnet suspended within a housing made of or protected by materials resistant to corrosion by UF6 containing a damping medium and having the magnet coupling with a pole piece or second magnet fitted to the top cap of the rotor;b.Active magnetic bearings specially designed or prepared for use with gas centrifuges;', '8.Specially prepared bearings comprising a pivot-cup assembly mounted on a damper;', '9.Molecular pumps comprised of cylinders having internally machined or extruded helical grooves and internally machined bores;', '10.Ring-shaped motor stators for multiphase AC hysteresis (or reluctance) motors for synchronous operation within a vacuum at a frequency of 600 Hz or more and a power of 40 VA or more;', '11.Centrifuge housing/recipients to contain the rotor tube assembly of a gas centrifuge, consisting of a rigid cylinder of wall thickness up to 30mm with precision machined ends that are parallel to each other and perpendicular to the cylinder’s longitudinal axis to within 0,05 ° or less;', '12.Scoops consisting of specially designed or prepared tubes for the extraction of UF6 gas from within the rotor tube by a Pitot tube action and capable of being fixed to the central gas extraction system;', '13.Frequency changers (converters or inverters) specially designed or prepared to supply motor stators for gas centrifuge enrichment, having all of the following characteristics, and specially designed components therefor:a.A multiphase frequency output of 600Hz or greater; andb.High stability (with frequency control better than 0,2%);', '14.Shut-off and control valves as follows:a.Shut-off valves specially designed or prepared to act on the feed, product or tails UF6 gaseous streams of an individual gas centrifuge;b.Bellows-sealed valves, shut-off or control, made of or protected by materials resistant to corrosion by UF6, with an inside diameter of 10mm to 160mm, specially designed or prepared for use in main or auxiliary systems of gas centrifuge enrichment plants;'"
0,0B,0B001.b.1.,"Maraging steel capable of an ultimate tensile strength of 1,95 GPa or more;",
0,0B,0B001.b.2.,"Aluminium alloys capable of an ultimate tensile strength of 0,46 GPa or more;

or",
0,0B,0B001.b.3.,"""Fibrous or filamentary materials"" with a ""specific modulus"" of more than 3,18 x 106m and a ""specific tensile strength"" greater than 7,62 x 104 m;",
0,0B,0B001.b.1.,Gas centrifuges;,
0,0B,0B001.b.2.,Complete rotor assemblies;,
0,0B,0B001.b.3.,"Rotor tube cylinders with a wall thickness of 12 mm or less, a diameter of between 75 mm and 650 mm, made from 'high strength-to-density ratio materials';",
0,0B,0B001.b.4.,"Rings or bellows with a wall thickness of 3 mm or less and a diameter of between 75 mm and 650 mm and designed to give local support to a rotor tube or to join a number together, made from 'high strength-to-density ratio materials';",
0,0B,0B001.b.5.,"Baffles of between 75 mm and 650 mm diameter for mounting inside a rotor tube, made from 'high strength-to-density ratio materials';",
0,0B,0B001.b.6.,"Top or bottom caps of between 75 mm and 650 mm diameter to fit the ends of a rotor tube, made from 'high strength-to-density ratio materials';",
0,0B,0B001.b.7.,Magnetic suspension bearings as follows:,
0,0B,0B001.b.7.a.,"Bearing assemblies consisting of an annular magnet suspended within a housing made of or protected by ""materials resistant to corrosion by UF6"" containing a damping medium and having the magnet coupling with a pole piece or second magnet fitted to the top cap of the rotor;",
0,0B,0B001.b.7.b.,Active magnetic bearings specially designed or prepared for use with gas centrifuges;,
0,0B,0B001.b.8.,Specially prepared bearings comprising a pivot-cup assembly mounted on a damper;,
0,0B,0B001.b.9.,Molecular pumps comprised of cylinders having internally machined or extruded helical grooves and internally machined bores;,
0,0B,0B001.b.10.,Ring-shaped motor stators for multiphase AC hysteresis (or reluctance) motors for synchronous operation within a vacuum at a frequency of 600 Hz or more and a power of 40 VA or more;,
0,0B,0B001.b.11.,"Centrifuge housing/recipients to contain the rotor tube assembly of a gas centrifuge, consisting of a rigid cylinder of wall thickness up to 30 mm with precision machined ends that are parallel to each other and perpendicular to the cylinder’s longitudinal axis to within 0,05 ° or less;",
0,0B,0B001.b.12.,Scoops consisting of specially designed or prepared tubes for the extraction of UF6 gas from within the rotor tube by a Pitot tube action and capable of being fixed to the central gas extraction system;,
0,0B,0B001.b.13.,"Frequency changers (converters or inverters) specially designed or prepared to supply motor stators for gas centrifuge enrichment, having all of the following characteristics, and specially designed components therefor:",
0,0B,0B001.b.13.a.,A multiphase frequency output of 600 Hz or greater; and,
0,0B,0B001.b.13.b.,"High stability (with frequency control better than 0,2%);",
0,0B,0B001.b.14.,Shut-off and control valves as follows:,
0,0B,0B001.b.14.a.,"Shut-off valves specially designed or prepared to act on the feed, product or tails UF6 gaseous streams of an individual gas centrifuge;",
0,0B,0B001.b.14.b.,"Bellows-sealed valves, shut-off or control, made of or protected by ""materials resistant to corrosion by UF6"", with an inside diameter of 10 mm to 160 mm, specially designed or prepared for use in main or auxiliary systems of gas centrifuge enrichment plants;",
0,0B,0B001.c.,"Equipment and components, specially designed or prepared for gaseous diffusion separation process, as follows:",
0,0B,0B001.c.1.,"Gaseous diffusion barriers made of porous metallic, polymer or ceramic ""materials resistant to corrosion by UF6"" with a pore size of 10 to 100 nm, a thickness of 5 mm or less, and, for tubular forms, a diameter of 25 mm or less;",
0,0B,0B001.c.2.,"Gaseous diffuser housings made of or protected by ""materials resistant to corrosion by UF6"";",
0,0B,0B001.c.3.,"Compressors or gas blowers with a suction volume capacity of 1 m3/min or more of UF6, with a discharge pressure up to 500 kPa, and having a pressure ratio of 10:1 or less, and made of or protected by ""materials resistant to corrosion by UF6"";",
0,0B,0B001.c.4.,Rotary shaft seals for compressors or blowers specified in 0B001.c.3. and designed for a buffer gas in-leakage rate of less than 1 000 cm3/min.;,
0,0B,0B001.c.5.,"Heat exchangers made of or protected by ""materials resistant to corrosion by UF6"", and designed for a leakage pressure rate of less than 10 Pa per hour under a pressure differential of 100 kPa;",
0,0B,0B001.c.6.,"Bellows-sealed valves, manual or automated, shut-off or control, made of or protected by ""materials resistant to corrosion by UF6"";",
0,0B,0B001.d.,"Equipment and components, specially designed or prepared for aerodynamic separation process, as follows:",
0,0B,0B001.d.1.,"Separation nozzles consisting of slit-shaped, curved channels having a radius of curvature less than 1 mm, resistant to corrosion by UF6, and having a knife-edge contained within the nozzle which separates the gas flowing through the nozzle into two streams;",
0,0B,0B001.d.2.,"Cylindrical or conical tubes, (vortex tubes), made of or protected by ""materials resistant to corrosion by UF6"" and with one or more tangential inlets;",
0,0B,0B001.d.3.,"Compressors or gas blowers made of or protected by ""materials resistant to corrosion by UF6"", and rotary shaft seals therefor;",
0,0B,0B001.d.4.,"Heat exchangers made of or protected by ""materials resistant to corrosion by UF6"";",
0,0B,0B001.d.5.,"Separation element housings, made of or protected by ""materials resistant to corrosion by UF6"" to contain vortex tubes or separation nozzles;",
0,0B,0B001.d.6.,"Bellows-sealed valves, manual or automated, shut-off or control, made of or protected by ""materials resistant to corrosion by UF6"", with a diameter of 40 mm or more;",
0,0B,0B001.d.7.,"Process systems for separating UF6 from carrier gas (hydrogen or helium) to 1 ppm UF6 content or less, including:",
0,0B,0B001.d.7.a.,Cryogenic heat exchangers and cryoseparators capable of temperatures of 153K (-120oC) or less;,
0,0B,0B001.d.7.b.,Cryogenic refrigeration units capable of temperatures of 153 K (-120oC) or less;,
0,0B,0B001.d.7.c.,Separation nozzle or vortex tube units for the separation of UF6 from carrier gas;,
0,0B,0B001.d.7.d.,UF6 cold traps capable of freezing out UF6;,
0,0B,0B001.e.,"Equipment and components, specially designed or prepared for chemical exchange separation process, as follows:",
0,0B,0B001.e.1.,Fast-exchange liquid-liquid pulse columns with stage residence time of 30 s or less and resistant to concentrated hydrochloric acid (e.g. made of or protected by suitable plastic materials such as fluorinated hydrocarbon polymers or glass);,
0,0B,0B001.e.2.,Fast-exchange liquid-liquid centrifugal contactors with stage residence time of 30 s or less and resistant to concentrated hydrochloric acid (e.g. made of or protected by suitable plastic materials such as fluorinated hydrocarbon polymers or glass);,
0,0B,0B001.e.3.,"Electrochemical reduction cells resistant to concentrated hydrochloric acid solutions, for reduction of uranium from one valence state to another;",
0,0B,0B001.e.4.,"Electrochemical reduction cells feed equipment to take U+4 from the organic stream and, for those parts in contact with the process stream, made of or protected by suitable materials (e.g. glass, fluorocarbon polymers, polyphenyl sulphate, polyether sulfone and resin-impregnated graphite);",
0,0B,0B001.e.5.,"Feed preparation systems for producing high purity uranium chloride solution consisting of dissolution, solvent extraction and/or ion exchange equipment for purification and electrolytic cells for reducing the uranium U+6 or U+4 to U+3;",
0,0B,0B001.e.6.,Uranium oxidation systems for oxidation of U+3 to U+4;,
0,0B,0B001.f.,"Equipment and components, specially designed or prepared for ion-exchange separation process, as follows:",
0,0B,0B001.f.1.,"Fast reacting ion-exchange resins, pellicular or porous macro-reticulated resins in which the active chemical exchange groups are limited to a coating on the surface of an inactive porous support structure, and other composite structures in any suitable form, including particles or fibres, with diameters of 0,2 mm or less, resistant to concentrated hydrochloric acid and designed to have an exchange rate half-time of less than 10 s and capable of operating at temperatures in the range of 373 K (100oC) to 473 K (200oC);",
0,0B,0B001.f.2.,"Ion exchange columns (cylindrical) with a diameter greater than 1 000 mm, made of or protected by materials resistant to concentrated hydrochloric acid (e.g. titanium or fluorocarbon plastics) and capable of operating at temperatures in the range of 373 K (100oC) to 473 K (200oC) and pressures above 0,7 MPa;",
0,0B,0B001.f.3.,Ion exchange reflux systems (chemical or electrochemical oxidation or reduction systems) for regeneration of the chemical reducing or oxidizing agents used in ion exchange enrichment cascades;,
0,0B,0B001.g.,"Equipment and components, specially designed or prepared for laser-based separation processes using atomic vapour laser isotope separation, as follows:",
0,0B,0B001.g.1.,Uranium metal vaporization systems designed to achieve a delivered power of 1 kW or more on the target for use in laser enrichment;,
0,0B,0B001.g.2.,"Liquid or vapour uranium metal handling systems specially designed or prepared for handling molten uranium, molten uranium alloys or uranium metal vapour for use in laser enrichment, and specially designed components therefor;",
0,0B,0B001.g.2.,,SEE ALSO 2A225.
0,0B,0B001.g.3.,"Product and tails collector assemblies for collecting uranium metal in liquid or solid form, made of or protected by materials resistant to the heat and corrosion of uranium metal vapour or liquid, such as yttria-coated graphite or tantalum;",
0,0B,0B001.g.4.,"Separator module housings (cylindrical or rectangular vessels) for containing the uranium metal vapour source, the electron beam gun and the product and tails collectors;",
0,0B,0B001.g.5.,"""Lasers"" or ""laser"" systems specially designed or prepared for the separation of uranium isotopes with a spectrum frequency stabilisation for operation over extended periods of time;",
0,0B,0B001.g.5.,,SEE ALSO 6A005 AND 6A205.
0,0B,0B001.h.,"Equipment and components, specially designed or prepared for laser-based separation processes using molecular laser isotope separation, as follows:",
0,0B,0B001.h.1.,"Supersonic expansion nozzles for cooling mixtures of UF6 and carrier gas to 150 K (-123oC) or less and made from ""materials resistant to corrosion by UF6"";",
0,0B,0B001.h.2.,"Product or tails collector components or devices specially designed or prepared for collecting uranium material or uranium tails material following illumination with laser light, made of ""materials resistant to corrosion by UF6"";",
0,0B,0B001.h.3.,"Compressors made of or protected by ""materials resistant to corrosion by UF6"", and rotary shaft seals therefor;",
0,0B,0B001.h.4.,Equipment for fluorinating UF5 (solid) to UF6 (gas);,
0,0B,0B001.h.5.,"Process systems for separating UF6 from carrier gas (e.g. nitrogen, argon or other gas) including:",
0,0B,0B001.h.5.a.,Cryogenic heat exchangers and cryoseparators capable of temperatures of 153 K (-120oC) or less;,
0,0B,0B001.h.5.b.,Cryogenic refrigeration units capable of temperatures of 153 K (-120oC) or less;,
0,0B,0B001.h.5.c.,UF6 cold traps capable of freezing out UF6;,
0,0B,0B001.h.6.,"""Lasers"" or ""laser"" systems specially designed or prepared for the separation of uranium isotopes with a spectrum frequency stabilisation for operation over extended periods of time;",
0,0B,0B001.h.6.,,SEE ALSO 6A005 AND 6A205.
0,0B,0B001.i.,"Equipment and components, specially designed or prepared for plasma separation process, as follows:",
0,0B,0B001.i.1.,"Microwave power sources and antennae for producing or accelerating ions, with an output frequency greater than 30 GHz and mean power output greater than 50 kW;",
0,0B,0B001.i.2.,Radio frequency ion excitation coils for frequencies of more than 100 kHz and capable of handling more than 40 kW mean power;,
0,0B,0B001.i.3.,Uranium plasma generation systems;,
0,0B,0B001.i.4.,Not used;,
0,0B,0B001.i.5.,"Product and tails collector assemblies for uranium metal in solid form, made of or protected by materials resistant to the heat and corrosion of uranium vapour such as yttria-coated graphite or tantalum;",
0,0B,0B001.i.6.,"Separator module housings (cylindrical) for containing the uranium plasma source, radio-frequency drive coil and the product and tails collectors and made of a suitable non-magnetic material (e.g. stainless steel);",
0,0B,0B001.j.,"Equipment and components, specially designed or prepared for electromagnetic separation process, as follows:",
0,0B,0B001.j.1.,"Ion sources, single or multiple, consisting of a vapour source, ioniser, and beam accelerator made of suitable non-magnetic materials (e.g. graphite, stainless steel, or copper) and capable of providing a total ion beam current of 50 mA or greater;",
0,0B,0B001.j.2.,"Ion collector plates for collection of enriched or depleted uranium ion beams, consisting of two or more slits and pockets and made of suitable non-magnetic materials (e.g. graphite or stainless steel);",
0,0B,0B001.j.3.,"Vacuum housings for uranium electromagnetic separators made of non-magnetic materials (e.g. stainless steel) and designed to operate at pressures of 0,1 Pa or lower;",
0,0B,0B001.j.4.,Magnet pole pieces with a diameter greater than 2 m;,
0,0B,0B001.j.5.,"High voltage power supplies for ion sources, having all of the following characteristics:",
0,0B,0B001.j.5.a.,Capable of continuous operation;,
0,0B,0B001.j.5.b.,Output voltage of 20 000 V or greater;,
0,0B,0B001.j.5.c.,Output current of 1 A or greater; and,
0,0B,0B001.j.5.d.,"Voltage regulation of better than 0,01% over a period of 8 hours;",
0,0B,0B001.j.5.d.,,SEE ALSO 3A227.
0,0B,0B001.j.6.,"Magnet power supplies (high power, direct current) having all of the following characteristics:",
0,0B,0B001.j.6.a.,Capable of continuous operation with a current output of 500 A or greater at a voltage of 100 V or greater; and,
0,0B,0B001.j.6.b.,"Current or voltage regulation better than 0,01% over a period of 8 hours.",
0,0B,0B001.j.6.b.,,SEE ALSO 3A226.
0,0B,0B002,"Specially designed or prepared auxiliary systems, equipment and components as follows, for isotope separation plant specified in 0B001, made of or protected by ""materials resistant to corrosion by UF6"":",
0,0B,0B002.a.,"Feed autoclaves, ovens or systems used for passing UF6 to the enrichment process;",
0,0B,0B002.b.,"Desublimers or cold traps, used to remove UF6 from the enrichment process for subsequent transfer upon heating;",
0,0B,0B002.c.,Product and tails stations for transferring UF6 into containers;,
0,0B,0B002.d.,"Liquefaction or solidification stations used to remove UF6 from the enrichment process by compressing, cooling and converting UF6 to a liquid or solid form;",
0,0B,0B002.e.,"Piping systems and header systems specially designed or prepared for handling UF6 within gaseous diffusion, centrifuge or aerodynamic cascades;",
0,0B,0B002.f.,Vacuum systems and pumps as follows:,
0,0B,0B002.f.1.,"Vacuum manifolds, vacuum headers or vacuum pumps having a suction capacity of 5 m3/minute or more;",
0,0B,0B002.f.2.,"Vacuum pumps specially designed for use in UF6 bearing atmospheres made of, or protected by, ""materials resistant to corrosion by UF6""; or",
0,0B,0B002.f.3.,"Vacuum systems consisting of vacuum manifolds, vacuum headers and vacuum pumps, and designed for service in UF6-bearing atmospheres;",
0,0B,0B002.g.,UF6 mass spectrometers/ion sources capable of taking on-line samples from UF6 gas streams and having all of the following characteristics:,
0,0B,0B002.g.1.,Capable of measuring ions of 320 atomic mass units or greater and having a resolution of better than 1 part in 320;,
0,0B,0B002.g.2.,"Ion sources constructed of or protected by nickel, nickel-copper alloys with a nickel content of 60% or more by weight, or nickel-chrome alloys;",
0,0B,0B002.g.3.,Electron bombardment ionisation sources; and,
0,0B,0B002.g.4.,Having a collector system suitable for isotopic analysis.,
0,0B,0B003,"Plant for the conversion of uranium and equipment specially designed or prepared therefor, as follows:",
0,0B,0B003.a.,Systems for the conversion of uranium ore concentrates to UO3;,
0,0B,0B003.b.,Systems for the conversion of UO3 to UF6;,
0,0B,0B003.c.,Systems for the conversion of UO3 to UO2;,
0,0B,0B003.d.,Systems for the conversion of UO2 to UF4;,
0,0B,0B003.e.,Systems for the conversion of UF4 to UF6;,
0,0B,0B003.f.,Systems for the conversion of UF4 to uranium metal;,
0,0B,0B003.g.,Systems for the conversion of UF6 to UO2;,
0,0B,0B003.h.,Systems for the conversion of UF6 to UF4;,
0,0B,0B003.i.,Systems for the conversion of UO2 to UCl4.,
0,0B,0B004,"Plant for the production or concentration of heavy water, deuterium and deuterium compounds and specially designed or prepared equipment and components therefor, as follows:",
0,0B,0B004.a.,"Plant for the production of heavy water, deuterium or deuterium compounds, as follows:",
0,0B,0B004.a.1.,Water-hydrogen sulphide exchange plants;,
0,0B,0B004.a.2.,Ammonia-hydrogen exchange plants;,
0,0B,0B004.b.,"Equipment and components, as follows:",
0,0B,0B004.b.1.,"Water-hydrogen sulphide exchange towers with diameters of 1,5 m or more, capable of operating at pressures greater than or equal to 2 MPa;",
0,0B,0B004.b.2.,"Single stage, low head (i.e., 0,2 MPa) centrifugal blowers or compressors for hydrogen sulphide gas circulation (i.e., gas containing more than 70% by weight hydrogen sulphide, H2S) with a throughput capacity greater than or equal to 56 m3/s when operating at pressures greater than or equal to 1,8 MPa suction and having seals designed for wet H2S service;",
0,0B,0B004.b.3.,"Ammonia-hydrogen exchange towers greater than or equal to 35 m in height with diameters of 1,5 m to 2,5 m capable of operating at pressures greater than 15 MPa;",
0,0B,0B004.b.4.,"Tower internals, including stage contactors, and stage pumps, including those which are submersible, for heavy water production utilizing the ammonia-hydrogen exchange process;",
0,0B,0B004.b.5.,Ammonia crackers with operating pressures greater than or equal to 3 MPa for heavy water production utilizing the ammonia-hydrogen exchange process;,
0,0B,0B004.b.6.,Infrared absorption analysers capable of on-line hydrogen/deuterium ratio analysis where deuterium concentrations are equal to or greater than 90% by weight;,
0,0B,0B004.b.7.,Catalytic burners for the conversion of enriched deuterium gas into heavy water utilizing the ammonia-hydrogen exchange process;,
0,0B,0B004.b.8.,"Complete heavy water upgrade systems, or columns therefor, for the upgrade of heavy water to reactor-grade deuterium concentration;",
0,0B,0B004.b.9.,Ammonia synthesis converters or synthesis units specially designed or prepared for heavy water production utilizing the ammonia-hydrogen exchange process.,
