categories,subcategories,items,description,notes
3,3A,3A002.d.4.b.,"Less (better) than -(206 - 20log10f) anywhere within the range of 10 kHz< F≤ 100 kHz anywhere within the frequency range exceeding 3,2 GHz but not exceeding 90 GHz;",
3,3A,3A002.d.4.b.,,"'RF modulation bandwidth is the Radio Frequency (RF) bandwidth occupied by a digitally encoded baseband signal modulated onto an RF signal. It is also referred to as information bandwidth or vector modulation bandwidth. I/Q digital modulation is the technical method for producing a vector-modulated RF output signal, and that output signal is typically specified as having an RF modulation bandwidth.'"
3,3A,3A002.d.5.a.,"Exceeding 2,2 GHz within the frequency range exceeding 4,8 GHz but not exceeding 31,8 GHz;",
3,3A,3A002.d.5.b.,"Exceeding 550 MHz within the frequency range exceeding 31,8 GHz but not exceeding 37 GHz; or",
3,3A,3A002.d.5.c.,"Exceeding 2,2 GHz within the frequency range exceeding 37 GHz but not exceeding 90 GHz; or",
3,3A,3A002.d.6.,A maximum frequency exceeding 90 GHz;,
3,3A,3A002.d.6.,,"For the purpose of 3A002.d., signal generators include arbitrary waveform and function generators."
3,3A,3A002.d.6.,,"3A002.d. does not control equipment in which the output frequency is either produced by the addition or subtraction of two or more crystal oscillator frequencies, or by an addition or subtraction followed by a multiplication of the result."
3,3A,3A002.d.6.,,'Nonlinear vector measurement functionality is an instrument’s ability to analyse the test results of devices driven into the large-signal domain or the non-linear distortion range.'
3,3A,3A002.e.1.,"An output power exceeding 31,62 mW (15 dBm) anywhere within the operating frequency range exceeding 43,5 GHz but not exceeding 90 GHz;",
3,3A,3A002.e.2.,An output power exceeding 1 mW (0 dBm) anywhere within the operating frequency range exceeding 90 GHz but not exceeding 110 GHz;,
3,3A,3A002.e.2.,,'Nonlinear vector measurement functionality is an instrument’s ability to analyse the test results of devices driven into the large-signal domain or the non-linear distortion range.'
3,3A,3A002.e.4.,A maximum operating frequency exceeding 110 GHz;,
3,3A,3A002.f.,Microwave test receivers having all of the following:,
3,3A,3A002.f.1.,A maximum operating frequency exceeding 110 GHz; and,
3,3A,3A002.f.2.,Being capable of measuring amplitude and phase simultaneously;,
3,3A,3A002.g.,Atomic frequency standards being any of the following:,
3,3A,3A002.g.1.,"""Space-qualified"";",
3,3A,3A002.g.2.,Non-rubidium and having a long-term stability less (better) than 1 x 10-11/month; or,
3,3A,3A002.g.3.,"Non-""space-qualified"" and having all of the following:",
3,3A,3A002.g.3.a.,Being a rubidium standard;,
3,3A,3A002.g.3.b.,Long-term stability less (better) than 1 x 10-11/month; and,
3,3A,3A002.g.3.c.,Total power consumption of less than 1 W;,
3,3A,3A002.h.,"""Electronic assemblies"", modules, or equipment, specified to perform all of the following:",
3,3A,3A002.h.1.,Analogue-to-digital conversions meeting any of the following:,
3,3A,3A002.h.1.a.,"A resolution of 8 bit or more, but less than 10 bit, with a ""sample rate"" greater than 1,3 Giga Samples Per Second (GSPS);",
3,3A,3A002.h.1.b.,"A resolution of 10 bit or more, but less than 12 bit, with a ""sample rate"" greater than 1,0 GSPS;",
3,3A,3A002.h.1.c.,"A resolution of 12 bit or more, but less than 14 bit, with a ""sample rate"" greater than 1,0 GSPS;",
3,3A,3A002.h.1.d.,"A resolution of 14 bit or more but less than 16 bit, with a ""sample rate"" greater than 400 Mega Samples Per Second (MSPS); or",
3,3A,3A002.h.1.e.,"A resolution of 16 bit or more with a ""sample rate"" greater than 180 MSPS; and",
3,3A,3A002.h.2.,Any of the following:,
3,3A,3A002.h.2.a.,Output of digitised data;,
3,3A,3A002.h.2.b.,Storage of digitised data; or,
3,3A,3A002.h.2.c.,Processing of digitised data;,
3,3A,3A002.h.2.c.,,"Digital data recorders, oscilloscopes, ""signal analysers"", signal generators, network analysers and microwave test receivers, are specified in 3A002.a.6., 3A002.a.7., 3A002.c., 3A002.d., 3A002.e. and 3A002.f., respectively."
3,3A,3A002.h.2.c.,,"3A002.h. includes ADC cards, waveform digitizers, data acquisition cards, signal acquisition boards and transient recorders."
3,3A,3A003,"Spray cooling thermal management systems employing closed loop fluid handling and reconditioning equipment in a sealed enclosure where a dielectric fluid is sprayed onto electronic components using specially designed spray nozzles that are designed to maintain electronic components within their operating temperature range, and specially designed components therefor.",
3,3A,3A101,"Electronic equipment, devices and components, other than those specified in 3A001, as follows:",
3,3A,3A101.a.,"Analogue-to-digital converters, usable in ""missiles"", designed to meet military specifications for ruggedized equipment;",
3,3A,3A101.b.,"Accelerators capable of delivering electromagnetic radiation produced by bremsstrahlung from accelerated electrons of 2 MeV or greater, and systems containing those accelerators.",
3,3A,3A101.b.,,3A101.b. above does not specify equipment specially designed for medical purposes.
3,3A,3A102,'Thermal batteries' designed or modified for 'missiles'.,
3,3A,3A201,"Electronic components, other than those specified in 3A001, as follows;",
3,3A,3A201.a.,Capacitors having either of the following sets of characteristics:,
3,3A,3A201.a.1.a.,"Voltage rating greater than 1,4 kV;",
3,3A,3A201.a.1.b.,Energy storage greater than 10 J;,
3,3A,3A201.a.1.c.,"Capacitance greater than 0,5 μF; and",
3,3A,3A201.a.1.d.,Series inductance less than 50 nH; or,
3,3A,3A201.a.2.a.,Voltage rating greater than 750 V;,
3,3A,3A201.a.2.b.,"Capacitance greater than 0,25 μF; and",
3,3A,3A201.a.2.c.,Series inductance less than 10 nH;,
3,3A,3A201.b.,Superconducting solenoidal electromagnets having all of the following characteristics:,
3,3A,3A201.b.1.,Capable of creating magnetic fields greater than 2 T;,
3,3A,3A201.b.2.,A ratio of length to inner diameter greater than 2;,
3,3A,3A201.b.3.,Inner diameter greater than 300 mm; and,
3,3A,3A201.b.4.,Magnetic field uniform to better than 1% over the central 50% of the inner volume;,
3,3A,3A201.b.4.,,"3A201.b. does not control magnets specially designed for and exported 'as parts of' medical nuclear magnetic resonance (NMR) imaging systems. The phrase 'as part of' does not necessarily mean physical part in the same shipment; separate shipments from different sources are allowed, provided the related export documents clearly specify that the shipments are dispatched 'as part of' the imaging systems."
3,3A,3A201.b.4.,,"'1.The figure of merit (K) is defined as:K = 1,7 x 103V2,65QV is the peak electron energy in million electron volts.If the accelerator beam pulse duration is less than or equal to 1μs, then Q is the total accelerated charge in Coulombs. If the accelerator beam pulse duration is greater than 1μs, then Q is the maximum accelerated charge in1μs.Q equals the integral of i with respect to t, over the lesser of 1μs or the time duration of the beam pulse (Q=∫idt), where i is beam current in amperes and t is time in seconds.', '2.Peak power = (peak potential in volts) x (peak beam current in amperes).', '3.In machines based on microwave accelerating cavities, the time duration of the beam pulse is the lesser of 1μs or the duration of the bunched beam packet resulting from one microwave modulator pulse.', '4.In machines based on microwave accelerating cavities, the peak beam current is the average current in the time duration of a bunched beam packet.'"
3,3A,3A201.c.1.a.,An accelerator peak electron energy of 500 keV or greater but less than 25 MeV; and,
3,3A,3A201.c.1.b.,"With a 'figure of merit' (K) of 0,25 or greater; or",
3,3A,3A201.c.2.a.,An accelerator peak electron energy of 25 MeV or greater; and,
3,3A,3A201.c.2.b.,A 'peak power' greater than 50 MW.,
3,3A,3A201.c.2.b.,,"3A201.c. does not control accelerators that are component parts of devices designed for purposes other than electron beam or X-ray radiation (electron microscopy, for example) nor those designed for medical purposes."
3,3A,3A201.c.1.,"K = 1,7 x 103V2,65Q",
3,3A,3A201.c.1.,V is the peak electron energy in million electron volts.,
3,3A,3A201.c.1.,"If the accelerator beam pulse duration is less than or equal to 1 μs, then Q is the total accelerated charge in Coulombs. If the accelerator beam pulse duration is greater than 1 μs, then Q is the maximum accelerated charge in 1 μs.",
3,3A,3A201.c.1.,"Q equals the integral of i with respect to t, over the lesser of 1 μs or the time duration of the beam pulse (Q = ∫ idt), where i is beam current in amperes and t is time in seconds.",
3,3A,3A225,"Frequency changers or generators, other than those specified in 0B001.b.13., usable as a variable or fixed frequency motor drive, having all of the following characteristics:",
3,3A,3A225,,Software specially designed to enhance or release the performance of a frequency changer or generator to meet the characteristics of 3A225 is specified in 3D225.
3,3A,3A225,,Technology in the form of codes or keys to enhance or release the performance of a frequency changer or generator to meet the characteristics of 3A225 is specified in 3E225.
3,3A,3A225.a.,Multiphase output providing a power of 40 VA or greater;,
3,3A,3A225.b.,Operating at a frequency of 600 Hz or more; and,
3,3A,3A225.c.,"Frequency control better (less) than 0,2%.",
3,3A,3A225.c.,,"3A225 does not control frequency changers or generators if they have hardware, software or technology constraints that limit the performance to less than that specified above, provided they meet any of the following:







1.



They need to be returned to the original manufacturer to make the enhancements or release the constraints











2.



They require software as specified in 3D225 to enhance or release the performance to meet the characteristics of 3A225

or












3.



They require technology in the form of keys or codes as specified in 3E225 to enhance or release the performance to meet the characteristics of 3A225."
3,3A,3A225.Note:1.,They need to be returned to the original manufacturer to make the enhancements or release the constraints;,
3,3A,3A225.Note:2.,"They require ""software"" as specified in 3D225 to enhance or release the performance to meet the characteristics of 3A225;

or",
3,3A,3A225.Note:3.,"They require ""technology"" in the form of keys or codes as specified in 3E225 to enhance or release the performance to meet the characteristics of 3A225.",
3,3A,3A226,"High-power direct current power supplies, other than those specified in 0B001.j.6., having both of the following characteristics:",
3,3A,3A226.a.,"Capable of continuously producing, over a time period of 8 hours, 100 V or greater with current output of 500 A or greater; and",
3,3A,3A226.b.,"Current or voltage stability better than 0,1% over a time period of 8 hours.",
3,3A,3A227,"High-voltage direct current power supplies, other than those specified in 0B001.j.5., having both of the following characteristics:",
3,3A,3A227.a.,"Capable of continuously producing, over a time period of 8 hours, 20 kV or greater with current output of 1 A or greater; and",
3,3A,3A227.b.,"Current or voltage stability better than 0,1% over a time period of 8 hours.",
3,3A,3A228,"Switching devices, as follows:",
3,3A,3A228.a.,"Cold-cathode tubes, whether gas filled or not, operating similarly to a spark gap, having all of the following characteristics:",
3,3A,3A228.a.1.,Containing three or more electrodes;,
3,3A,3A228.a.2.,"Anode peak voltage rating of 2,5 kV or more;",
3,3A,3A228.a.3.,Anode peak current rating of 100 A or more; and,
3,3A,3A228.a.4.,Anode delay time of 10 μs or less;,
3,3A,3A228.a.4.,,3A228 includes gas krytron tubes and vacuum sprytron tubes.
3,3A,3A228.b.,Triggered spark-gaps having both of the following characteristics:,
3,3A,3A228.b.1.,An anode delay time of 15 μs or less; and,
3,3A,3A228.b.2.,Rated for a peak current of 500 A or more;,
3,3A,3A228.c.,"Modules or assemblies with a fast switching function, other than those specified in 3A001.g. or 3A001.h., having all of the following characteristics:",
3,3A,3A228.c.1.,Anode peak voltage rating greater than 2 kV;,
3,3A,3A228.c.2.,Anode peak current rating of 500 A or more; and,
3,3A,3A228.c.3.,Turn-on time of 1 μs or less.,
3,3A,3A229,High-current pulse generators as follows:,
3,3A,3A229,,SEE ALSO MILITARY GOODS CONTROLS.
3,3A,3A229.a.,"Detonator firing sets (initiator systems, firesets), including electronically-charged, explosively-driven and optically-driven firing sets, other than those specified in 1A007.a., designed to drive multiple controlled detonators specified in 1A007.b.;",
3,3A,3A229.b.,Modular electrical pulse generators (pulsers) having all of the following characteristics:,
3,3A,3A229.b.1.,"Designed for portable, mobile, or ruggedized-use;",
3,3A,3A229.b.2.,Capable of delivering their energy in less than 15 μs into loads of less than 40 ohms;,
3,3A,3A229.b.3.,Having an output greater than 100 A;,
3,3A,3A229.b.4.,No dimension greater than 30 cm;,
3,3A,3A229.b.5.,Weight less than 30 kg; and,
3,3A,3A229.b.6.,Specified for use over an extended temperature range 223 K (-50oC) to 373 K (100oC) or specified as suitable for aerospace applications.,
3,3A,3A229.b.6.,,3A229.b. includes xenon flash-lamp drivers.
3,3A,3A229.c.,Micro-firing units having all of the following characteristics:,
3,3A,3A229.c.1.,No dimension greater than 35 mm;,
3,3A,3A229.c.2.,Voltage rating of equal to or greater than 1 kV; and,
3,3A,3A229.c.3.,Capacitance of equal to or greater than 100 nF.,
3,3A,3A230,"High-speed pulse generators, and 'pulse heads' therefor, having both of the following characteristics:",
3,3A,3A230.a.,Output voltage greater than 6 V into a resistive load of less than 55 ohms; and,
3,3A,3A230.b.,'Pulse transition time' less than 500 ps.,
3,3A,3A231,"Neutron generator systems, including tubes, having both of the following characteristics:",
3,3A,3A231.a.,Designed for operation without an external vacuum system; and,
3,3A,3A231.b.,Utilizing any of the following:,
3,3A,3A231.b.1.,Electrostatic acceleration to induce a tritium-deuterium nuclear reaction; or,
3,3A,3A231.b.2.,Electrostatic acceleration to induce a deuterium-deuterium nuclear reaction and capable of an output of 3 x 109 neutrons/s or greater.,
3,3A,3A232,"Multipoint initiation systems, other than those specified in 1A007, as follows:",
3,3A,3A232,,SEE ALSO MILITARY GOODS CONTROLS.
3,3A,3A232,,See 1A007.b. for detonators.
3,3A,3A232.a.,Not used;,
3,3A,3A232.b.,"Arrangements using single or multiple detonators designed to nearly simultaneously initiate an explosive surface over an area greater than 5 000 mm2 from a single firing signal with an initiation timing spread over the surface of less than 2,5 μs.",
3,3A,3A232.b.,,"3A232 does not control detonators using only primary explosives, such as lead azide."
3,3A,3A233,"Mass spectrometers, other than those specified in 0B002.g., capable of measuring ions of 230 u or greater and having a resolution of better than 2 parts in 230, as follows, and ion sources therefor:",
3,3A,3A233.a.,Inductively coupled plasma mass spectrometers (ICP/MS);,
3,3A,3A233.b.,Glow discharge mass spectrometers (GDMS);,
3,3A,3A233.c.,Thermal ionisation mass spectrometers (TIMS);,
3,3A,3A233.d.,Electron bombardment mass spectrometers having both of the following features:,
3,3A,3A233.d.1.,A molecular beam inlet system that injects a collimated beam of analyte molecules into a region of the ion source where the molecules are ionised by an electron beam; and,
3,3A,3A233.d.2.,One or more 'cold traps' that can be cooled to a temperature of 193 K (-80°C);,
3,3A,3A233.e.,Not used;,
3,3A,3A233.f.,Mass spectrometers equipped with a microfluorination ion source designed for actinides or actinide fluorides.,
3,3A,3A234,Striplines to provide low inductance path to detonators with the following characteristics:,
3,3A,3A234.a.,Voltage rating greater than 2 kV; and,
3,3A,3A234.b,Inductance of less than 20 nH.,
3,3B,3B001,"Equipment for the manufacturing of semiconductor devices or materials, as follows and specially designed components and accessories therefor:",
3,3B,3B001,,SEE ALSO 2B226
3,3B,3B001.a.,Equipment designed for epitaxial growth as follows:,
3,3B,3B001.a.1.,"Equipment designed or modified to produce a layer of any material other than silicon with a thickness uniform to less than ± 2,5% across a distance of 75 mm or more;",
3,3B,3B001.a.1.,,3B001.a.1. includes Atomic Layer Epitaxy (ALE) equipment.
3,3B,3B001.a.2.,"Metal Organic Chemical Vapour Deposition (MOCVD) reactors designed for compound semiconductor epitaxial growth of material having two or more of the following elements: aluminium, gallium, indium, arsenic, phosphorus, antimony, or nitrogen;",
3,3B,3B001.a.3.,Molecular beam epitaxial growth equipment using gas or solid sources;,
3,3B,3B001.b.,Equipment designed for ion implantation and having any of the following:,
3,3B,3B001.b.1.,Not used;,
3,3B,3B001.b.2.,"Being designed and optimised to operate at a beam energy of 20 keV or more and a beam current of 10 mA or more for hydrogen, deuterium or helium implant;",
3,3B,3B001.b.3.,Direct write capability;,
3,3B,3B001.b.4.,"A beam energy of 65 keV or more and a beam current of 45 mA or more for high energy oxygen implant into a heated semiconductor material ""substrate""; or",
3,3B,3B001.b.5.,"Being designed and optimised to operate at a beam energy of 20 keV or more and a beam current of 10 mA or more for silicon implant into a semiconductor material ""substrate"" heated to 600°C or greater;",
3,3B,3B001.c.,Not used;,
3,3B,3B001.d.,Not used;,
3,3B,3B001.d.,,"'1.For the purpose of 3B001.e., semiconductor process tools refers to modular tools that provide physical processes for semiconductor production that are functionally different, such as deposition, implant or thermal processing.', '2.For the purpose of 3B001.e., sequential multiple wafer processing means the capability to process each wafer in different semiconductor process tools, such as by transferring each wafer from one tool to a second tool and on to a third tool with the automatic loading multi-chamber central wafer handling systems.'"
3,3B,3B001.e.1.,"Interfaces for wafer input and output, to which more than two functionally different 'semiconductor process tools' specified in 3B001.a.1., 3B001.a.2., 3B001.a.3. or 3B001.b. are designed to be connected; and",
3,3B,3B001.e.2.,Designed to form an integrated system in a vacuum environment for 'sequential multiple wafer processing';,
3,3B,3B001.e.2.,,3B001.e. does not control automatic robotic wafer handling systems specially designed for parallel wafer processing.
3,3B,3B001.e.2.,,"'The Minimum Resolvable Feature size (MRF) is calculated by the following formula:', '', 'where the K factor = 0,35'"
3,3B,3B001.e.2.,,"'The Minimum Resolvable Feature size (MRF) is calculated by the following formula:', '', 'where the K factor = 0,35'"
3,3B,3B001.f.1.a.,A light source wavelength shorter than 193 nm; or,
3,3B,3B001.f.1.a.,,"'The Minimum Resolvable Feature size (MRF) is calculated by the following formula:', '', 'where the K factor = 0,35'"
3,3B,3B001.f.2.,Imprint lithography equipment capable of producing features of 45 nm or less;,
3,3B,3B001.f.2.,,
3,3B,3B001.f.3.,Equipment specially designed for mask making having all of the following:,
3,3B,3B001.f.3.a.,"A deflected focussed electron beam, ion beam or ""laser"" beam; and",
3,3B,3B001.f.3.b.,Having any of the following:,
3,3B,3B001.f.4.,"Equipment designed for device processing using direct writing methods, having all of the following:",
3,3B,3B001.f.4.a.,A deflected focused electron beam; and,
3,3B,3B001.f.4.b.,Having any of the following:,
3,3B,3B001.g.,"Masks and reticles, designed for integrated circuits specified in 3A001;",
3,3B,3B001.h.,Multi-layer masks with a phase shift layer not specified in 3B001.g. and designed to be used by lithography equipment having a light source wavelength less than 245 nm;,
3,3B,3B001.h.,,3B001.h. does not control multi-layer masks with a phase shift layer designed for the fabrication of memory devices not specified in 3A001.
3,3B,3B001.h.,,"For masks and reticles, specially designed for optical sensors, see 6B002."
3,3B,3B001.i.,Imprint lithography templates designed for integrated circuits specified in 3A001.,
3,3B,3B001.i.,,'Extreme Ultraviolet (EUV) refers to electromagnetic spectrum wavelengths greater than 5 nm and less than 124 nm.'
3,3B,3B001.j.1.,Specially designed for 'Extreme Ultraviolet' ('EUV') lithography; and,
3,3B,3B001.j.2.,Compliant with SEMI Standard P37.,
3,3B,3B002,Test equipment specially designed for testing finished or unfinished semiconductor devices as follows and specially designed components and accessories therefor:,
3,3B,3B002.a.,For testing S-parameters of items specified in 3A001.b.3.;,
3,3B,3B002.b.,Not used;,
3,3B,3B002.c.,For testing items specified in 3A001.b.2.,
3,3C,3C001,"Hetero-epitaxial materials consisting of a ""substrate"" having stacked epitaxially grown multiple layers of any of the following:",
3,3C,3C001.a.,Silicon (Si);,
3,3C,3C001.b.,Germanium (Ge);,
3,3C,3C001.c.,Silicon carbide (SiC); or,
3,3C,3C001.d.,"""III/V compounds"" of gallium or indium.",
3,3C,3C001.d.,,"3C001.d. does not control a substrate having one or more P-type epitaxial layers of GaN, InGaN, AlGaN, InAlN, InAlGaN, GaP, GaAs, AlGaAs, InP, InGaP, AlInP or InGaAlP, independent of the sequence of the elements, except if the P-type epitaxial layer is between N-type layers."
3,3C,3C002,"Resist materials as follows and ""substrates"" coated with the following resists:",
3,3C,3C002.a.,Resists designed for semiconductor lithography as follows:,
3,3C,3C002.a.1.,Positive resists adjusted (optimised) for use at wavelengths less than 193 nm but equal to or greater than 15 nm;,
3,3C,3C002.a.2.,Resists adjusted (optimised) for use at wavelengths less than 15 nm but greater than 1 nm;,
3,3C,3C002.b.,"All resists designed for use with electron beams or ion beams, with a sensitivity of 0,01 μcoulomb/mm2 or better;",
3,3C,3C002.c.,Not used;,
3,3C,3C002.d.,All resists optimised for surface imaging technologies;,
3,3C,3C002.e.,All resists designed or optimised for use with imprint lithography equipment specified in 3B001.f.2. that use either a thermal or photo-curable process.,
3,3C,3C003,Organo-inorganic compounds as follows:,
3,3C,3C003.a.,"Organo-metallic compounds of aluminium, gallium or indium, having a purity (metal basis) better than 99,999%;",
3,3C,3C003.b.,"Organo-arsenic, organo-antimony and organo-phosphorus compounds, having a purity (inorganic element basis) better than 99,999%.",
3,3C,3C003.b.,,"3C003 only controls compounds whose metallic, partly metallic or non-metallic element is directly linked to carbon in the organic part of the molecule."
3,3C,3C004,"Hydrides of phosphorus, arsenic or antimony, having a purity better than 99,999%, even diluted in inert gases or hydrogen.",
3,3C,3C004,,3C004 does not control hydrides containing 20% molar or more of inert gases or hydrogen.
3,3C,3C005,High resistivity materials as follows:,
3,3C,3C005.a.,"Silicon carbide (SiC), gallium nitride (GaN), aluminium nitride (AlN) or aluminium gallium nitride (AlGaN) semiconductor ""substrates"", or ingots, boules, or other preforms of those materials, having resistivities greater than 10 000 ohm-cm at 20°C;",
3,3C,3C005.b.,"Polycrystalline ""substrates"" or polycrystalline ceramic ""substrates"", having resistivities greater than 10 000 ohm-cm at 20°C and having at least one non-epitaxial single-crystal layer of silicon (Si), silicon carbide (SiC), gallium nitride (GaN), aluminium nitride (AlN), or aluminium gallium nitride (AlGaN) on the surface of the ""substrate"".",
3,3C,3C006,"Materials, not specified in 3C001, consisting of a ""substrate"" specified in 3C005 with at least one epitaxial layer of silicon carbide, gallium nitride, aluminium nitride or aluminium gallium nitride.",
3,3D,3D001,"""Software"" specially designed for the ""development"" or ""production"" of equipment specified in 3A001.b. to 3A002.h. or 3B.",
3,3D,3D002,"""Software"" specially designed for the ""use"" of equipment specified in 3B001.a. to f., 3B002 or 3A225",
3,3D,3D003,"'Computational lithography' ""software"" specially designed for the ""development"" of patterns on EUV-lithography masks or reticles.",
3,3D,3D004,"""Software"" specially designed for the ""development"" of equipment specified in 3A003.",
3,3D,3D005,"""Software"" specially designed to restore normal operation of a microcomputer, ""microprocessor microcircuit"" or ""microcomputer microcircuit"" within 1 ms after an Electromagnetic Pulse (EMP) or Electrostatic Discharge (ESD) disruption, without loss of continuation of operation.",
3,3D,3D101,"""Software"" specially designed or modified for the ""use"" of equipment specified in 3A101.b.",
3,3D,3D225,"""Software"" specially designed to enhance or release the performance of frequency changers or generators to meet the characteristics of 3A225.",
3,3E,3E001,"""Technology"" according to the General Technology Note for the ""development"" or ""production"" of equipment or materials specified in 3A, 3B or 3C;",
3,3E,3E001,,3E001 does not control technology for equipment or components specified in 3A003.
3,3E,3E001,,"3E001 does not control technology for integrated circuits specified in 3A001.a.3. to 3A001.a.12., having all of the following:"
